{
  "$schema": "https://json-schema.org/draft/2020-12/schema",
  "$id": "https://moritzbrantner.github.io/asset-tooling/schemas/humanoid-sockets-v1.schema.json",
  "title": "asset-tooling humanoid sockets v1",
  "description": "Attachment frames on a humanoid rig. An attached item's grip frame is placed at joint world x T(translation) x R(rotation) x S(scale), in the joint's local glTF frame. Joint membership in the rig, finite values and unit quaternions are checked by validateHumanoidSocketDescriptor.",
  "type": "object",
  "additionalProperties": false,
  "required": ["schema", "character", "unit", "axes", "attachFrame", "sockets"],
  "properties": {
    "schema": { "const": "humanoid-sockets-v1" },
    "character": { "type": "string", "pattern": "^[a-z0-9]+(?:[._-][a-z0-9]+)*$" },
    "unit": { "const": "meter" },
    "axes": { "const": "right-handed-y-up" },
    "attachFrame": { "const": "grip" },
    "sockets": {
      "type": "array",
      "minItems": 1,
      "maxItems": 256,
      "items": { "$ref": "#/$defs/socket" }
    }
  },
  "$defs": {
    "socket": {
      "type": "object",
      "additionalProperties": false,
      "required": ["id", "joint", "translation", "rotation", "accepts"],
      "properties": {
        "id": { "type": "string", "pattern": "^[a-z0-9]+(?:_[a-z0-9]+)*(?:\\.[a-z0-9]+(?:[_-][a-z0-9]+)*)+$" },
        "joint": { "type": "string", "minLength": 1, "maxLength": 256 },
        "translation": { "type": "array", "items": { "type": "number", "minimum": -10, "maximum": 10 }, "minItems": 3, "maxItems": 3 },
        "rotation": {
          "description": "Unit quaternion (x, y, z, w).",
          "type": "array", "items": { "type": "number", "minimum": -1, "maximum": 1 }, "minItems": 4, "maxItems": 4
        },
        "scale": { "type": "array", "items": { "type": "number", "exclusiveMinimum": 0, "maximum": 100 }, "minItems": 3, "maxItems": 3 },
        "accepts": {
          "type": "array",
          "minItems": 1,
          "uniqueItems": true,
          "items": { "type": "string", "pattern": "^[a-z0-9]+(?:-[a-z0-9]+)*$" }
        }
      }
    }
  }
}
