{
  "schema": "humanoid-sockets-v1",
  "character": "humanoid.ranger.female",
  "unit": "meter",
  "axes": "right-handed-y-up",
  "attachFrame": "grip",
  "sockets": [
    {"id": "hand_r.weapon", "joint": "hand_r",
     "translation": [-0.0324, 0.0643, -0.0002], "rotation": [0.426214, 0.564233, 0.438511, 0.554699],
     "accepts": ["one-hand-weapon"]},
    {"id": "hand_l.shield", "joint": "hand_l",
     "translation": [0.0324, 0.0643, -0.0002], "rotation": [0.426214, -0.564233, -0.438511, 0.554699],
     "accepts": ["shield"]},
    {"id": "back.stowed", "joint": "spine_03",
     "translation": [0, -0.061607, -0.226519], "rotation": [0, 0.993595, 0.113001, 0],
     "accepts": ["shield"]},
    {"id": "hip_l.stowed", "joint": "pelvis",
     "translation": [0.175, 0.142748, 0.127956], "rotation": [-0.667907, 0.090365, -0.701309, 0.232164],
     "accepts": ["one-hand-weapon"]},
    {"id": "hand_l.bow", "joint": "hand_l",
     "translation": [0.0324, 0.0643, -0.0002], "rotation": [0.008695, 0.791205, 0.611453, 0.006742],
     "accepts": ["bow"]},
    {"id": "hand_r.arrow", "joint": "hand_r",
     "translation": [-0.0324, 0.0643, -0.0002], "rotation": [-0.090852, 0.0889, 0.709047, 0.69361],
     "accepts": ["arrow"]},
    {"id": "back.quiver", "joint": "spine_03",
     "translation": [-0.07, 0.0521, -0.2122], "rotation": [-0.166726, 0.981057, 0.097242, 0.016526],
     "accepts": ["quiver"]},
    {"id": "back.bow.stowed", "joint": "spine_03",
     "translation": [0.02, -0.0107, -0.3064], "rotation": [-0.314686, -0.944057, -0.093574, 0.031191],
     "accepts": ["bow"]},
    {"id": "head.hair", "joint": "Head",
     "translation": [0, -1.5491, 0.0389], "rotation": [-0.009042, 0, 0, 0.999959],
     "accepts": ["hair"]},
    {"id": "head.armor", "joint": "Head",
     "translation": [0, -1.5491, 0.0389], "rotation": [-0.009042, 0, 0, 0.999959],
     "accepts": ["armor"]},
    {"id": "spine_03.armor", "joint": "spine_03",
     "translation": [0, -1.2658, -0.2517], "rotation": [0.098636, 0, 0, 0.995124],
     "accepts": ["armor"]},
    {"id": "pelvis.armor", "joint": "pelvis",
     "translation": [0, -0.8931, 0.2696], "rotation": [-0.121803, 0, 0, 0.992554],
     "accepts": ["armor"]},
    {"id": "clavicle_l.armor", "joint": "clavicle_l",
     "translation": [-0.0282, -0.0166, -1.4305], "rotation": [0.610253, 0.357459, 0.357764, 0.609769],
     "accepts": ["armor"]},
    {"id": "clavicle_r.armor", "joint": "clavicle_r",
     "translation": [0.0282, -0.0166, -1.4305], "rotation": [0.610253, -0.357459, -0.357764, 0.609769],
     "accepts": ["armor"]},
    {"id": "upperarm_l.armor", "joint": "upperarm_l",
     "translation": [1.4181, -0.1526, 0.0512], "rotation": [0.006677, -0.006563, 0.707075, 0.707076],
     "accepts": ["armor"]},
    {"id": "upperarm_r.armor", "joint": "upperarm_r",
     "translation": [-1.4181, -0.1526, 0.0512], "rotation": [0.006677, 0.006563, -0.707075, 0.707076],
     "accepts": ["armor"]},
    {"id": "lowerarm_l.armor", "joint": "lowerarm_l",
     "translation": [1.4181, -0.39, 0.0701], "rotation": [-0.010213, 0.010211, 0.707033, 0.707033],
     "accepts": ["armor"]},
    {"id": "lowerarm_r.armor", "joint": "lowerarm_r",
     "translation": [-1.4181, -0.39, 0.0701], "rotation": [-0.010213, -0.010211, -0.707033, 0.707033],
     "accepts": ["armor"]},
    {"id": "hand_l.armor", "joint": "hand_l",
     "translation": [1.4181, -0.6418, 0.0414], "rotation": [0.005612, -0.005611, 0.707085, 0.707084],
     "accepts": ["armor"]},
    {"id": "hand_r.armor", "joint": "hand_r",
     "translation": [-1.4181, -0.6418, 0.0414], "rotation": [0.005612, 0.005611, -0.707085, 0.707084],
     "accepts": ["armor"]},
    {"id": "thigh_l.armor", "joint": "thigh_l",
     "translation": [-0.1114, 0.9455, -0.0068], "rotation": [-0.999717, 0, 0, 0.023795],
     "accepts": ["armor"]},
    {"id": "thigh_r.armor", "joint": "thigh_r",
     "translation": [0.1114, 0.9455, -0.0068], "rotation": [-0.999717, 0, 0, 0.023795],
     "accepts": ["armor"]},
    {"id": "calf_l.armor", "joint": "calf_l",
     "translation": [-0.1114, 0.5292, -0.0829], "rotation": [0.998873, 0, 0, 0.047468],
     "accepts": ["armor"]},
    {"id": "calf_r.armor", "joint": "calf_r",
     "translation": [0.1114, 0.5292, -0.0829], "rotation": [0.998873, 0, 0, 0.047468],
     "accepts": ["armor"]},
    {"id": "foot_l.armor", "joint": "foot_l",
     "translation": [-0.1114, 0.0974, 0.0369], "rotation": [-0.829078, 0, 0, 0.559133],
     "accepts": ["armor"]},
    {"id": "foot_r.armor", "joint": "foot_r",
     "translation": [0.1114, 0.0974, 0.0369], "rotation": [-0.829078, 0, 0, 0.559133],
     "accepts": ["armor"]}
  ]
}
